{
  "dossier_version": "0.1-candidate",
  "institution_id": "COV037",
  "institution_name": "Devawongse Varopakarn Institute of Foreign Affairs (DVIFA)",
  "country": "Thailand",
  "peer_type": "STATE_FOREIGN_SERVICE",
  "entity_resolution_status": "CANDIDATE",
  "retrieved_on": "2026-08-27",
  "public_evidence_only": true,
  "source_register": [
    {"source_id":"S1","url":"https://dvifa.mfa.go.th/en/page/dvifa","source_tier":"A","retrieved_on":"2026-08-27","source_type":"official ministry institutional page","title":"DVIFA","publisher_or_owner":"Ministry of Foreign Affairs, Thailand","supports":["history","training","testing","target groups","institutional identity"],"notes":"Primary institutional source."},
    {"source_id":"S2","url":"https://dvifa.mfa.go.th/en/page/79146-vision-values-and-mission-of-the-devawongse?menu=5d6aa27a15e39c2a2c007909","source_tier":"A","retrieved_on":"2026-08-27","source_type":"official mission page","title":"Vision, Values and Mission of DVIFA","publisher_or_owner":"Ministry of Foreign Affairs, Thailand","supports":["mission","training","evaluation","research","publication","international cooperation"],"notes":"Defines current institutional functions."},
    {"source_id":"S3","url":"https://dvifa.mfa.go.th/en/page/mou","source_tier":"A","retrieved_on":"2026-08-27","source_type":"official cooperation register","title":"MOU","publisher_or_owner":"Ministry of Foreign Affairs, Thailand","supports":["verified international cooperation"],"notes":"Lists formal diplomatic-training cooperation agreements."}
  ],
  "institutional_core": {
    "mission": "Build diplomatic and foreign-affairs capacity, language and communication competence, testing/evaluation capability, research and international cooperation for Thai and foreign officials.",
    "governance": "An institute of Thailand's Ministry of Foreign Affairs.",
    "programme_model": "Regular and customised programmes for MFA staff, other Thai agencies, foreign diplomats, civil servants, students and the public.",
    "learning_model": "Diplomacy/foreign-affairs training delivered through courses, lectures, seminars, presentations and workshops, combined with language and communication development.",
    "assessment_model": "DVIFA operates government-facing English language testing, including DIFA TES, and maintains an evaluation/standards function.",
    "research_model": "The official mission includes development as a think tank producing studies, policy recommendations, seminars and publications on strategic foreign-affairs issues.",
    "professional_practice_model": "Training targets personnel performing diplomatic, foreign-affairs and overseas government functions across career levels.",
    "international_cooperation_model": "Formal MoUs with foreign diplomatic academies and training institutions, plus short-term international training and meeting participation.",
    "credential_model": "The reviewed sources document testing and training functions but do not establish a general academic credential model.",
    "digital_transparency_model": "Official pages expose mission, organisation, programme functions, testing, leadership and formal cooperation.",
    "distinctive_practices": ["combined training-and-testing mandate","government language assessment","formal diplomatic-academy MOU network","research and publication mission","training for both domestic and foreign officials"],
    "methodology_lessons_for_wpa": ["Assessment discipline deserves independent visibility because some institutes operate formal testing systems.","Verified MOU registers are substantially stronger than unsupported partnership claims for I18.","Research mandate and publication mission should be separated from actual output counts and traceability.","Training for foreign diplomats is a useful peer-type/context variable but not a prestige proxy."]
  },
  "indicator_evidence": [
    {"indicator_id":"I01","evidence_status":"PARTIALLY_SUPPORTED","source_ids":["S2"],"extraction_note":"Research/publication is a formal mission; a verified output corpus requires deeper extraction.","human_score_status":"NOT_REVIEWED"},
    {"indicator_id":"I02","evidence_status":"NE","source_ids":[],"extraction_note":"Persistent research identifiers/repository evidence not yet extracted.","human_score_status":"NOT_REVIEWED"},
    {"indicator_id":"I03","evidence_status":"NE","source_ids":[],"extraction_note":"Citation/reference visibility not established.","human_score_status":"NOT_REVIEWED"},
    {"indicator_id":"I04","evidence_status":"SUPPORTED","source_ids":["S2"],"extraction_note":"Diplomacy/foreign-affairs research and policy recommendation are formal institutional functions.","human_score_status":"NOT_REVIEWED"},
    {"indicator_id":"I05","evidence_status":"PARTIALLY_SUPPORTED","source_ids":["S3"],"extraction_note":"Academic/training cooperation is documented; research-specific co-production requires more evidence.","human_score_status":"NOT_REVIEWED"},
    {"indicator_id":"I06","evidence_status":"SUPPORTED","source_ids":["S1","S2"],"extraction_note":"Multiple regular and customised programme types are documented.","human_score_status":"NOT_REVIEWED"},
    {"indicator_id":"I07","evidence_status":"PARTIALLY_SUPPORTED","source_ids":["S2"],"extraction_note":"Capacity objectives are explicit; formal learning-outcome matrices are not yet extracted.","human_score_status":"NOT_REVIEWED"},
    {"indicator_id":"I08","evidence_status":"SUPPORTED","source_ids":["S1","S2"],"extraction_note":"Government language testing and evaluation functions are explicit.","human_score_status":"NOT_REVIEWED"},
    {"indicator_id":"I09","evidence_status":"PARTIALLY_SUPPORTED","source_ids":["S1"],"extraction_note":"Institutional/leadership information is public; systematic faculty/trainer transparency requires more review.","human_score_status":"NOT_REVIEWED"},
    {"indicator_id":"I10","evidence_status":"PARTIALLY_SUPPORTED","source_ids":["S1"],"extraction_note":"Testing integrity is visible; broader credential/completion verification is not established.","human_score_status":"NOT_REVIEWED"},
    {"indicator_id":"I11","evidence_status":"SUPPORTED","source_ids":["S1","S2"],"extraction_note":"Training is directly tied to diplomatic and foreign-affairs professional functions.","human_score_status":"NOT_REVIEWED"},
    {"indicator_id":"I12","evidence_status":"PARTIALLY_SUPPORTED","source_ids":["S1"],"extraction_note":"Applied professional training is evident; published case-study structure is not established.","human_score_status":"NOT_REVIEWED"},
    {"indicator_id":"I13","evidence_status":"PARTIALLY_SUPPORTED","source_ids":["S1"],"extraction_note":"Workshops and applied training are explicit; simulations/scenario methods need deeper evidence.","human_score_status":"NOT_REVIEWED"},
    {"indicator_id":"I14","evidence_status":"PARTIALLY_SUPPORTED","source_ids":["S1"],"extraction_note":"Training serves practitioners, while named practitioner integration requires further evidence.","human_score_status":"NOT_REVIEWED"},
    {"indicator_id":"I15","evidence_status":"SUPPORTED","source_ids":["S2"],"extraction_note":"Training, testing, policy research and public-service support provide direct knowledge-transfer functions.","human_score_status":"NOT_REVIEWED"},
    {"indicator_id":"I16","evidence_status":"SUPPORTED","source_ids":["S1","S2"],"extraction_note":"Identity, history and mission are publicly documented by the MFA.","human_score_status":"NOT_REVIEWED"},
    {"indicator_id":"I17","evidence_status":"NE","source_ids":[],"extraction_note":"No dedicated public correction/provenance mechanism established in this pass.","human_score_status":"NOT_REVIEWED"},
    {"indicator_id":"I18","evidence_status":"SUPPORTED","source_ids":["S3"],"extraction_note":"Formal cooperation agreements with peer academies are publicly listed.","human_score_status":"NOT_REVIEWED"},
    {"indicator_id":"I19","evidence_status":"SUPPORTED","source_ids":["S1","S2","S3"],"extraction_note":"Extensive official public information is available across programme, mission, testing and cooperation pages.","human_score_status":"NOT_REVIEWED"},
    {"indicator_id":"I20","evidence_status":"NE","source_ids":[],"extraction_note":"Ethics/COI/data/credential-governance safeguards require separate review.","human_score_status":"NOT_REVIEWED"}
  ],
  "agent_trace": {"agent_role":"Evidence Agent + Indicator-Mapping Agent + Methodology-Learning Agent","queries_or_routes":["official DVIFA overview","mission page","official MOU register"],"access_boundaries_respected":true,"access_notes":"Public official sources only.","uncertainties":["research output corpus","formal programme learning outcomes","faculty transparency","ethics/COI/data governance"]},
  "human_review": {"status":"PENDING","reviewer_authority_required":true,"reviewed_on":null,"review_notes":"First-pass Asia-Pacific anchor dossier; no final score or canonical inclusion decision.","correction_status":"NOT_OPEN"}
}
