{
  "dossier_version": "0.1-candidate",
  "institution_id": "COV005",
  "institution_name": "Diplomatic Academy of the Ministry of Foreign Affairs",
  "country": "Poland",
  "peer_type": "STATE_FOREIGN_SERVICE",
  "entity_resolution_status": "CANDIDATE",
  "retrieved_on": "2026-08-27",
  "public_evidence_only": true,
  "source_register": [
    {
      "source_id": "S1",
      "url": "https://www.gov.pl/web/diplomacy/diplomatic-academy",
      "source_tier": "A",
      "retrieved_on": "2026-08-27",
      "source_type": "official ministry institutional page",
      "title": "Diplomatic Academy",
      "publisher_or_owner": "Ministry of Foreign Affairs, Republic of Poland",
      "supports": ["identity","governance","training strategy","career-stage training","pre-posting training","diplomatic-consular examination","language training","international cooperation"],
      "notes": "Primary source used for this first-pass methodology-development dossier."
    },
    {
      "source_id": "S2",
      "url": "https://www.gov.pl/web/diplomacy/organisational-units",
      "source_tier": "A",
      "retrieved_on": "2026-08-27",
      "source_type": "official ministry organisational page",
      "title": "Organisational units",
      "publisher_or_owner": "Ministry of Foreign Affairs, Republic of Poland",
      "supports": ["institutional identity","organisational status"],
      "notes": "Confirms the Diplomatic Academy as a current MFA organisational unit."
    }
  ],
  "institutional_core": {
    "mission": "Develop and implement the MFA training strategy and support professional development of ministry and mission staff throughout their careers.",
    "governance": "An organisational unit of the Polish Ministry of Foreign Affairs.",
    "programme_model": "Induction, preparatory service, Career Diplomat Programmes, pre-posting, specialist, soft-skills, e-learning and language-development provision.",
    "learning_model": "Career-stage professional formation combining diplomatic/consular preparation, specialist training, language proficiency and international exchange opportunities.",
    "assessment_model": "The Academy organises the Diplomatic and Consular Exam and manages language proficiency verification/exams.",
    "research_model": null,
    "professional_practice_model": "Pre-posting training is tailored to prospective responsibilities in diplomatic missions abroad.",
    "international_cooperation_model": "The Academy collaborates with domestic/international training institutions, foreign ministries and international organisations and facilitates exchange programmes for foreign officials.",
    "credential_model": "The Diplomatic and Consular Exam is linked to entry into the career diplomatic path and receipt of the first diplomatic rank; this dossier does not infer broader credential authority beyond the source.",
    "digital_transparency_model": "Official MFA pages identify the Academy, management, training functions and contact route.",
    "distinctive_practices": ["career-stage training strategy","pre-posting training aligned to mission responsibilities","formal diplomatic-consular examination","language proficiency governance","international exchange and scholarship facilitation"],
    "methodology_lessons_for_wpa": ["Career-stage architecture should remain visible in I06 rather than being collapsed into a generic programme count.","Formal professional examinations are stronger evidence for I08 than workshop attendance alone.","Pre-posting training provides a strong applied-practice signal for I11-I13.","International cooperation should be scored from documented functions/agreements, not from partnership name-dropping."]
  },
  "indicator_evidence": [
    {"indicator_id":"I01","evidence_status":"NE","source_ids":[],"extraction_note":"No research-output corpus established in this first pass.","human_score_status":"NOT_REVIEWED"},
    {"indicator_id":"I02","evidence_status":"NE","source_ids":[],"extraction_note":"No research identifier/repository evidence established.","human_score_status":"NOT_REVIEWED"},
    {"indicator_id":"I03","evidence_status":"NE","source_ids":[],"extraction_note":"No citation/reference visibility evidence established.","human_score_status":"NOT_REVIEWED"},
    {"indicator_id":"I04","evidence_status":"PARTIALLY_SUPPORTED","source_ids":["S1"],"extraction_note":"The Academy contributes to diplomatic professional capability; scholarly knowledge contribution requires separate evidence.","human_score_status":"NOT_REVIEWED"},
    {"indicator_id":"I05","evidence_status":"PARTIALLY_SUPPORTED","source_ids":["S1"],"extraction_note":"International institutional cooperation is documented; research collaboration specifically is not established.","human_score_status":"NOT_REVIEWED"},
    {"indicator_id":"I06","evidence_status":"SUPPORTED","source_ids":["S1"],"extraction_note":"Multiple clearly differentiated career-stage and specialist programmes are described.","human_score_status":"NOT_REVIEWED"},
    {"indicator_id":"I07","evidence_status":"PARTIALLY_SUPPORTED","source_ids":["S1"],"extraction_note":"Programme objectives are stated, while formal learning-outcome matrices require deeper review.","human_score_status":"NOT_REVIEWED"},
    {"indicator_id":"I08","evidence_status":"SUPPORTED","source_ids":["S1"],"extraction_note":"Diplomatic-consular examination and language assessment functions are explicit.","human_score_status":"NOT_REVIEWED"},
    {"indicator_id":"I09","evidence_status":"PARTIALLY_SUPPORTED","source_ids":["S1"],"extraction_note":"Management is public; faculty/trainer-level transparency requires additional sources.","human_score_status":"NOT_REVIEWED"},
    {"indicator_id":"I10","evidence_status":"PARTIALLY_SUPPORTED","source_ids":["S1"],"extraction_note":"Exam-based career entry is clear; broader credential-verification mechanics are not established.","human_score_status":"NOT_REVIEWED"},
    {"indicator_id":"I11","evidence_status":"SUPPORTED","source_ids":["S1"],"extraction_note":"Training is embedded in the professional formation of serving MFA and mission personnel.","human_score_status":"NOT_REVIEWED"},
    {"indicator_id":"I12","evidence_status":"PARTIALLY_SUPPORTED","source_ids":["S1"],"extraction_note":"Pre-posting role-specific training supports applied practice; published case-method evidence is not established.","human_score_status":"NOT_REVIEWED"},
    {"indicator_id":"I13","evidence_status":"PARTIALLY_SUPPORTED","source_ids":["S1"],"extraction_note":"Applied training is evident; explicit simulation/scenario documentation requires deeper review.","human_score_status":"NOT_REVIEWED"},
    {"indicator_id":"I14","evidence_status":"PARTIALLY_SUPPORTED","source_ids":["S1"],"extraction_note":"Institutional setting implies practitioner-led training, but trainer-role evidence is incomplete.","human_score_status":"NOT_REVIEWED"},
    {"indicator_id":"I15","evidence_status":"SUPPORTED","source_ids":["S1"],"extraction_note":"Professional development is directly transferred into MFA and overseas mission functions.","human_score_status":"NOT_REVIEWED"},
    {"indicator_id":"I16","evidence_status":"SUPPORTED","source_ids":["S1","S2"],"extraction_note":"Identity, organisational status, management and contact route are publicly clear.","human_score_status":"NOT_REVIEWED"},
    {"indicator_id":"I17","evidence_status":"NE","source_ids":[],"extraction_note":"No dedicated public correction/provenance mechanism established in this pass.","human_score_status":"NOT_REVIEWED"},
    {"indicator_id":"I18","evidence_status":"SUPPORTED","source_ids":["S1"],"extraction_note":"International institutional collaboration and exchanges are explicitly described.","human_score_status":"NOT_REVIEWED"},
    {"indicator_id":"I19","evidence_status":"SUPPORTED","source_ids":["S1","S2"],"extraction_note":"Official public pages expose core institutional and programme information.","human_score_status":"NOT_REVIEWED"},
    {"indicator_id":"I20","evidence_status":"NE","source_ids":[],"extraction_note":"Ethics/COI/data/credential-governance safeguards require separate evidence.","human_score_status":"NOT_REVIEWED"}
  ],
  "agent_trace": {"agent_role":"Evidence Agent + Indicator-Mapping Agent + Methodology-Learning Agent","queries_or_routes":["official Polish MFA Diplomatic Academy page","official MFA organisational units"],"access_boundaries_respected":true,"access_notes":"Public official sources only; no restricted access or private data used.","uncertainties":["research corpus","faculty-level transparency","formal learning outcomes","ethics/COI/data governance"]},
  "human_review": {"status":"PENDING","reviewer_authority_required":true,"reviewed_on":null,"review_notes":"First-pass regional anchor dossier; no final score or canonical inclusion decision.","correction_status":"NOT_OPEN"}
}
