{
  "dossier_version": "0.1-candidate",
  "institution_id": "COV009",
  "institution_name": "Diplomatic Institute, Ministry of Foreign Affairs",
  "country": "Qatar",
  "peer_type": "STATE_FOREIGN_SERVICE",
  "entity_resolution_status": "CANDIDATE",
  "retrieved_on": "2026-08-27",
  "public_evidence_only": true,
  "source_register": [
    {"source_id":"S1","url":"https://mofa.gov.qa/en/the-ministry/organizational-structure/diplomatic-institute","source_tier":"A","retrieved_on":"2026-08-27","source_type":"official ministry institutional page","title":"Diplomatic Institute","publisher_or_owner":"Ministry of Foreign Affairs, State of Qatar","supports":["identity","training mandate","research","policy analysis","consultation","international cooperation","library"],"notes":"Primary source for institutional functions."},
    {"source_id":"S2","url":"https://mofa.gov.qa/en/the-ministry/organizational-structure/organizational-structure","source_tier":"A","retrieved_on":"2026-08-27","source_type":"official ministry organisational page","title":"Organizational Structure","publisher_or_owner":"Ministry of Foreign Affairs, State of Qatar","supports":["organisational status","current director"],"notes":"Confirms the Institute in the 2022-approved MFA structure."}
  ],
  "institutional_core": {
    "mission": "Prepare, qualify and train ministry and mission personnel for diplomatic, consular and international-cooperation work while supporting research, analysis and consultation.",
    "governance": "A formal administrative unit within Qatar's Ministry of Foreign Affairs.",
    "programme_model": "Courses, training sessions and special qualification programmes for MFA personnel and representative missions.",
    "learning_model": "Practical and theoretical capacity development linked to diplomatic and consular work.",
    "assessment_model": null,
    "research_model": "The Institute is mandated to prepare studies and research on diplomacy, international political and economic relations and regional/international issues.",
    "professional_practice_model": "Training is directly tied to ministry, mission and diplomatic-consular operational roles.",
    "international_cooperation_model": "The Institute may cooperate with universities and similar institutes inside and outside Qatar and participate in international meetings and seminars.",
    "credential_model": null,
    "digital_transparency_model": "Official MFA pages describe mandate, governance, director and contact details.",
    "distinctive_practices": ["integration of training and policy research","formal consultation mandate to public bodies","mission-personnel training","institutional library support","cooperation with universities and peer institutes"],
    "methodology_lessons_for_wpa": ["Research and professional training can coexist inside a state diplomatic institute and should be measured separately.","A formal consultation mandate is strong evidence for knowledge transfer and professional impact.","Library/information infrastructure is useful contextual evidence but should not become a standalone prestige proxy."]
  },
  "indicator_evidence": [
    {"indicator_id":"I01","evidence_status":"SUPPORTED","source_ids":["S1"],"extraction_note":"The official mandate explicitly includes studies and research.","human_score_status":"NOT_REVIEWED"},
    {"indicator_id":"I02","evidence_status":"NE","source_ids":[],"extraction_note":"No DOI/ISBN/repository traceability established in this pass.","human_score_status":"NOT_REVIEWED"},
    {"indicator_id":"I03","evidence_status":"NE","source_ids":[],"extraction_note":"No citation/reference visibility evidence established.","human_score_status":"NOT_REVIEWED"},
    {"indicator_id":"I04","evidence_status":"SUPPORTED","source_ids":["S1"],"extraction_note":"Research and analysis in diplomacy and international relations are formal functions.","human_score_status":"NOT_REVIEWED"},
    {"indicator_id":"I05","evidence_status":"PARTIALLY_SUPPORTED","source_ids":["S1"],"extraction_note":"Institutional cooperation is documented; specific research co-authorship/collaboration requires more evidence.","human_score_status":"NOT_REVIEWED"},
    {"indicator_id":"I06","evidence_status":"SUPPORTED","source_ids":["S1"],"extraction_note":"Courses, sessions and special qualification programmes are part of the formal mandate.","human_score_status":"NOT_REVIEWED"},
    {"indicator_id":"I07","evidence_status":"PARTIALLY_SUPPORTED","source_ids":["S1"],"extraction_note":"Capacity-development objectives are explicit; formal learning-outcome statements are not.","human_score_status":"NOT_REVIEWED"},
    {"indicator_id":"I08","evidence_status":"NE","source_ids":[],"extraction_note":"No formal assessment/examination rule established in the reviewed sources.","human_score_status":"NOT_REVIEWED"},
    {"indicator_id":"I09","evidence_status":"PARTIALLY_SUPPORTED","source_ids":["S2"],"extraction_note":"Leadership is public; faculty/trainer transparency requires deeper review.","human_score_status":"NOT_REVIEWED"},
    {"indicator_id":"I10","evidence_status":"NE","source_ids":[],"extraction_note":"Credential/completion verification not established.","human_score_status":"NOT_REVIEWED"},
    {"indicator_id":"I11","evidence_status":"SUPPORTED","source_ids":["S1"],"extraction_note":"The Institute directly trains personnel for diplomatic, consular and mission functions.","human_score_status":"NOT_REVIEWED"},
    {"indicator_id":"I12","evidence_status":"PARTIALLY_SUPPORTED","source_ids":["S1"],"extraction_note":"Operational policy analysis is documented; published applied cases are not yet established.","human_score_status":"NOT_REVIEWED"},
    {"indicator_id":"I13","evidence_status":"NE","source_ids":[],"extraction_note":"No explicit simulation/scenario evidence in the sources used.","human_score_status":"NOT_REVIEWED"},
    {"indicator_id":"I14","evidence_status":"PARTIALLY_SUPPORTED","source_ids":["S1"],"extraction_note":"Training is institutionally practitioner-facing; named practitioner integration requires further evidence.","human_score_status":"NOT_REVIEWED"},
    {"indicator_id":"I15","evidence_status":"SUPPORTED","source_ids":["S1"],"extraction_note":"Consultation, policy analysis and direct capacity development provide clear knowledge-transfer functions.","human_score_status":"NOT_REVIEWED"},
    {"indicator_id":"I16","evidence_status":"SUPPORTED","source_ids":["S1","S2"],"extraction_note":"Institutional identity and location in the MFA structure are clear.","human_score_status":"NOT_REVIEWED"},
    {"indicator_id":"I17","evidence_status":"NE","source_ids":[],"extraction_note":"No public correction/provenance mechanism established.","human_score_status":"NOT_REVIEWED"},
    {"indicator_id":"I18","evidence_status":"SUPPORTED","source_ids":["S1"],"extraction_note":"Cooperation with universities and similar institutes is part of the formal mandate.","human_score_status":"NOT_REVIEWED"},
    {"indicator_id":"I19","evidence_status":"SUPPORTED","source_ids":["S1","S2"],"extraction_note":"Official pages expose mandate, structure, director and contact details.","human_score_status":"NOT_REVIEWED"},
    {"indicator_id":"I20","evidence_status":"NE","source_ids":[],"extraction_note":"Ethics/COI/data/credential-governance safeguards require separate review.","human_score_status":"NOT_REVIEWED"}
  ],
  "agent_trace": {"agent_role":"Evidence Agent + Indicator-Mapping Agent + Methodology-Learning Agent","queries_or_routes":["official Qatar MFA Diplomatic Institute page","official organisational structure"],"access_boundaries_respected":true,"access_notes":"Public official sources only.","uncertainties":["assessment","credential model","research identifiers","faculty transparency","ethics/COI/data governance"]},
  "human_review": {"status":"PENDING","reviewer_authority_required":true,"reviewed_on":null,"review_notes":"First-pass MENA anchor dossier; no final score or canonical inclusion decision.","correction_status":"NOT_OPEN"}
}
