{
  "dossier_version": "0.1-candidate",
  "institution_id": "COV001",
  "institution_name": "MFA Diplomatic Academy",
  "country": "Singapore",
  "peer_type": "STATE_FOREIGN_SERVICE",
  "entity_resolution_status": "CANDIDATE",
  "retrieved_on": "2026-08-27",
  "public_evidence_only": true,
  "source_register": [
    {
      "source_id": "S1",
      "url": "https://www.mfa.gov.sg/about-mfa/diplomatic-academy/",
      "source_tier": "A",
      "retrieved_on": "2026-08-27",
      "source_type": "official institutional page",
      "title": "Diplomatic Academy",
      "publisher_or_owner": "Ministry of Foreign Affairs, Singapore",
      "supports": ["identity", "establishment", "programme model", "career-stage training", "simulations", "practitioner integration", "international benchmarking"],
      "notes": "Primary-source basis for this initial methodology-development dossier. No private or restricted source was used."
    }
  ],
  "institutional_core": {
    "mission": "Professional development of MFA officers and relevant public officials through structured diplomatic learning across career stages.",
    "governance": "An academy within Singapore's Ministry of Foreign Affairs.",
    "programme_model": "Career-stage programmes including foundation/basic training, pre-posting preparation and management development.",
    "learning_model": "Structured diplomatic training incorporating practitioner knowledge, policy discussion and scenario-based methods.",
    "assessment_model": null,
    "research_model": null,
    "professional_practice_model": "Uses simulations, policy gaming and experienced diplomatic practitioners as part of professional preparation.",
    "international_cooperation_model": "The official page describes international benchmarking/exchanges and engagement with foreign diplomatic academies and partners.",
    "credential_model": null,
    "digital_transparency_model": "The official MFA provides a dedicated public Academy page describing its role and training model.",
    "distinctive_practices": [
      "career-stage diplomatic professional development",
      "pre-posting preparation",
      "management development for diplomatic officers",
      "simulations and policy gaming",
      "use of senior practitioners and external expertise",
      "international benchmarking with other diplomatic academies"
    ],
    "methodology_lessons_for_wpa": [
      "Career-stage progression is a recurring institutional capability that should be visible within programme architecture and professional-practice evidence.",
      "Simulation and policy-gaming evidence strongly supports keeping practice-based training as a distinct indicator.",
      "Practitioner integration should remain separately visible from general faculty transparency.",
      "International benchmarking is useful evidence of institutional learning, but should not be treated as quality merely because a partnership is claimed."
    ]
  },
  "indicator_evidence": [
    {"indicator_id":"I01","evidence_status":"NE","source_ids":[],"extraction_note":"No sufficient research-output evidence extracted from the source used in this first-pass dossier.","human_score_status":"NOT_REVIEWED"},
    {"indicator_id":"I02","evidence_status":"NE","source_ids":[],"extraction_note":"No DOI/ISBN/repository traceability evidence extracted in this first pass.","human_score_status":"NOT_REVIEWED"},
    {"indicator_id":"I03","evidence_status":"NE","source_ids":[],"extraction_note":"No citation/reference-visibility evidence extracted in this first pass.","human_score_status":"NOT_REVIEWED"},
    {"indicator_id":"I04","evidence_status":"PARTIALLY_SUPPORTED","source_ids":["S1"],"extraction_note":"The Academy contributes to diplomatic professional knowledge through structured training; this source alone does not establish a broader scholarly knowledge-output claim.","human_score_status":"NOT_REVIEWED"},
    {"indicator_id":"I05","evidence_status":"PARTIALLY_SUPPORTED","source_ids":["S1"],"extraction_note":"International benchmarking and engagement are described; research collaboration specifically is not sufficiently established by this source.","human_score_status":"NOT_REVIEWED"},
    {"indicator_id":"I06","evidence_status":"SUPPORTED","source_ids":["S1"],"extraction_note":"Distinct career-stage programme architecture is publicly described.","human_score_status":"NOT_REVIEWED"},
    {"indicator_id":"I07","evidence_status":"PARTIALLY_SUPPORTED","source_ids":["S1"],"extraction_note":"Professional-development aims are clear, but formal learning-outcome statements require deeper source review.","human_score_status":"NOT_REVIEWED"},
    {"indicator_id":"I08","evidence_status":"PARTIALLY_SUPPORTED","source_ids":["S1"],"extraction_note":"Simulations and policy gaming are documented, but formal assessment/examination rules are not established by this source.","human_score_status":"NOT_REVIEWED"},
    {"indicator_id":"I09","evidence_status":"SUPPORTED","source_ids":["S1"],"extraction_note":"Senior diplomats, practitioners and external experts are described as part of the learning model.","human_score_status":"NOT_REVIEWED"},
    {"indicator_id":"I10","evidence_status":"NE","source_ids":[],"extraction_note":"Credential/completion verification is not established in this first-pass source.","human_score_status":"NOT_REVIEWED"},
    {"indicator_id":"I11","evidence_status":"SUPPORTED","source_ids":["S1"],"extraction_note":"The Academy is embedded in a national foreign ministry and trains serving officials.","human_score_status":"NOT_REVIEWED"},
    {"indicator_id":"I12","evidence_status":"PARTIALLY_SUPPORTED","source_ids":["S1"],"extraction_note":"Scenario/policy exercises support applied practice, while formal published case-study evidence requires deeper review.","human_score_status":"NOT_REVIEWED"},
    {"indicator_id":"I13","evidence_status":"SUPPORTED","source_ids":["S1"],"extraction_note":"Simulations and policy gaming are explicitly documented.","human_score_status":"NOT_REVIEWED"},
    {"indicator_id":"I14","evidence_status":"SUPPORTED","source_ids":["S1"],"extraction_note":"Practitioner integration is explicit in the Academy's training model.","human_score_status":"NOT_REVIEWED"},
    {"indicator_id":"I15","evidence_status":"PARTIALLY_SUPPORTED","source_ids":["S1"],"extraction_note":"Professional capability transfer into MFA practice is intrinsic to the training mandate; broader documented impact requires additional evidence.","human_score_status":"NOT_REVIEWED"},
    {"indicator_id":"I16","evidence_status":"SUPPORTED","source_ids":["S1"],"extraction_note":"Institutional identity and parent-ministry relationship are clear on the official source.","human_score_status":"NOT_REVIEWED"},
    {"indicator_id":"I17","evidence_status":"NE","source_ids":[],"extraction_note":"An institutional correction/provenance mechanism was not established in this first-pass review.","human_score_status":"NOT_REVIEWED"},
    {"indicator_id":"I18","evidence_status":"SUPPORTED","source_ids":["S1"],"extraction_note":"The Academy's international benchmarking/engagement is publicly documented by its parent ministry.","human_score_status":"NOT_REVIEWED"},
    {"indicator_id":"I19","evidence_status":"SUPPORTED","source_ids":["S1"],"extraction_note":"A dedicated official public page provides accessible institutional and programme information.","human_score_status":"NOT_REVIEWED"},
    {"indicator_id":"I20","evidence_status":"NE","source_ids":[],"extraction_note":"Ethics/COI/data/credential-governance safeguards require separate evidence review.","human_score_status":"NOT_REVIEWED"}
  ],
  "agent_trace": {
    "agent_role": "Evidence Agent + Methodology-Learning Agent",
    "queries_or_routes": ["official MFA Diplomatic Academy page"],
    "access_boundaries_respected": true,
    "access_notes": "Public official source only; no login, restricted portal, private data or technical bypass used.",
    "uncertainties": ["formal assessment rules", "research-output corpus", "credential model", "ethics/COI/data governance"]
  },
  "human_review": {
    "status": "PENDING",
    "reviewer_authority_required": true,
    "reviewed_on": null,
    "review_notes": "First-pass methodology-development dossier. No final score or canonical inclusion decision has been made.",
    "correction_status": "NOT_OPEN"
  }
}
