{
  "dossier_version": "0.1-candidate",
  "institution_id": "COV043",
  "institution_name": "Academia Diplomática del Perú Javier Pérez de Cuéllar",
  "country": "Peru",
  "peer_type": "STATE_FOREIGN_SERVICE",
  "entity_resolution_status": "CANDIDATE",
  "retrieved_on": "2026-08-27",
  "public_evidence_only": true,
  "source_register": [
    {"source_id":"S1","url":"https://www.gob.pe/74822-ministerio-de-relaciones-exteriores-academia-diplomatica-del-peru","source_tier":"A","retrieved_on":"2026-08-27","source_type":"official government institutional page","title":"Academia Diplomática del Perú","publisher_or_owner":"Ministerio de Relaciones Exteriores del Perú","supports":["identity","governance","professional training","career entry","continuous development"],"notes":"Primary institutional source."},
    {"source_id":"S2","url":"https://www.gob.pe/institucion/rree/institucional","source_tier":"A","retrieved_on":"2026-08-27","source_type":"official ministry institutional overview","title":"Información institucional","publisher_or_owner":"Ministerio de Relaciones Exteriores del Perú","supports":["institutional status","research role","career route"],"notes":"Identifies the Academy as a higher professional training and research centre and sole entry route to the diplomatic career."}
  ],
  "institutional_core": {
    "mission": "Provide professional formation for candidates to Peru's Diplomatic Service and continuous training and development for serving diplomatic personnel.",
    "governance": "A professional training centre of Peru's Ministry of Foreign Affairs, dependent on the Vice Minister of Foreign Affairs and governed by its own regulations.",
    "programme_model": "Initial professional formation linked to admission into the Diplomatic Service plus continuous training and professional development.",
    "learning_model": "Structured professional diplomatic formation tied directly to career entry and continued service development.",
    "assessment_model": "Admission to the Academy and progression into the Diplomatic Service are formally regulated; this first-pass dossier does not yet map the full internal assessment system.",
    "research_model": "The Ministry identifies the Academy as a higher professional training and research centre.",
    "professional_practice_model": "The Academy is the sole entry route to the Diplomatic Service and trains serving members of that service.",
    "international_cooperation_model": null,
    "credential_model": "The Academy's institutional role is linked to entry into the Diplomatic Service; detailed credential issuance/verification requires deeper source review.",
    "digital_transparency_model": "Official government pages expose mandate, governance relationship, admission-related information and institutional role.",
    "distinctive_practices": ["sole institutional entry route to the national Diplomatic Service","combined initial formation and continuing professional development","formal ministry governance with own regulations","explicit training-and-research identity"],
    "methodology_lessons_for_wpa": ["Career-entry exclusivity is a distinctive institutional function but should not automatically increase academic quality scores.","Formal governance/regulatory clarity is strong I16 evidence.","A research-centre designation requires output-level evidence before I01 receives a high score.","Initial formation and continuing professional development should remain separately visible in programme architecture analysis."]
  },
  "indicator_evidence": [
    {"indicator_id":"I01","evidence_status":"PARTIALLY_SUPPORTED","source_ids":["S2"],"extraction_note":"The Academy is officially described as a research centre; output-level evidence remains to be extracted.","human_score_status":"NOT_REVIEWED"},
    {"indicator_id":"I02","evidence_status":"NE","source_ids":[],"extraction_note":"No DOI/ISBN/repository traceability evidence established in this pass.","human_score_status":"NOT_REVIEWED"},
    {"indicator_id":"I03","evidence_status":"NE","source_ids":[],"extraction_note":"No citation/reference visibility evidence established.","human_score_status":"NOT_REVIEWED"},
    {"indicator_id":"I04","evidence_status":"SUPPORTED","source_ids":["S1","S2"],"extraction_note":"Diplomatic professional formation and research are explicit institutional functions.","human_score_status":"NOT_REVIEWED"},
    {"indicator_id":"I05","evidence_status":"NE","source_ids":[],"extraction_note":"International research collaboration not established in the sources used.","human_score_status":"NOT_REVIEWED"},
    {"indicator_id":"I06","evidence_status":"SUPPORTED","source_ids":["S1"],"extraction_note":"Initial formation and continuing professional development are clearly differentiated functions.","human_score_status":"NOT_REVIEWED"},
    {"indicator_id":"I07","evidence_status":"PARTIALLY_SUPPORTED","source_ids":["S1"],"extraction_note":"Professional-formation objectives are clear; formal learning-outcome statements require deeper review.","human_score_status":"NOT_REVIEWED"},
    {"indicator_id":"I08","evidence_status":"PARTIALLY_SUPPORTED","source_ids":["S1"],"extraction_note":"Admission and career-entry regulation imply formal assessment processes; detailed rules are not yet extracted.","human_score_status":"NOT_REVIEWED"},
    {"indicator_id":"I09","evidence_status":"NE","source_ids":[],"extraction_note":"Faculty/practitioner transparency not established in this first pass.","human_score_status":"NOT_REVIEWED"},
    {"indicator_id":"I10","evidence_status":"PARTIALLY_SUPPORTED","source_ids":["S1"],"extraction_note":"Career-entry status is institutionally clear; credential-verification mechanisms require more evidence.","human_score_status":"NOT_REVIEWED"},
    {"indicator_id":"I11","evidence_status":"SUPPORTED","source_ids":["S1","S2"],"extraction_note":"The Academy is directly embedded in recruitment and professional development of the national Diplomatic Service.","human_score_status":"NOT_REVIEWED"},
    {"indicator_id":"I12","evidence_status":"PARTIALLY_SUPPORTED","source_ids":["S1"],"extraction_note":"Applied professional formation is inherent to the mandate; published applied-case evidence is not established.","human_score_status":"NOT_REVIEWED"},
    {"indicator_id":"I13","evidence_status":"NE","source_ids":[],"extraction_note":"No simulation/scenario evidence established in the reviewed sources.","human_score_status":"NOT_REVIEWED"},
    {"indicator_id":"I14","evidence_status":"PARTIALLY_SUPPORTED","source_ids":["S1"],"extraction_note":"The Academy serves a professional diplomatic career system; explicit practitioner-teaching evidence requires deeper review.","human_score_status":"NOT_REVIEWED"},
    {"indicator_id":"I15","evidence_status":"SUPPORTED","source_ids":["S1"],"extraction_note":"Training is directly transferred into entry and continued performance in the Diplomatic Service.","human_score_status":"NOT_REVIEWED"},
    {"indicator_id":"I16","evidence_status":"SUPPORTED","source_ids":["S1","S2"],"extraction_note":"Identity, ministry relationship, governing authority and regulatory basis are publicly clear.","human_score_status":"NOT_REVIEWED"},
    {"indicator_id":"I17","evidence_status":"NE","source_ids":[],"extraction_note":"No public correction/provenance mechanism established in this pass.","human_score_status":"NOT_REVIEWED"},
    {"indicator_id":"I18","evidence_status":"NE","source_ids":[],"extraction_note":"Verified international cooperation requires additional source review.","human_score_status":"NOT_REVIEWED"},
    {"indicator_id":"I19","evidence_status":"SUPPORTED","source_ids":["S1","S2"],"extraction_note":"Official public pages provide core identity, role, governance and access-to-career information.","human_score_status":"NOT_REVIEWED"},
    {"indicator_id":"I20","evidence_status":"NE","source_ids":[],"extraction_note":"Ethics/COI/data/credential-governance safeguards require separate review.","human_score_status":"NOT_REVIEWED"}
  ],
  "agent_trace": {"agent_role":"Evidence Agent + Indicator-Mapping Agent + Methodology-Learning Agent","queries_or_routes":["official Peru government Academy page","official MFA institutional overview"],"access_boundaries_respected":true,"access_notes":"Public official sources only.","uncertainties":["faculty transparency","assessment details","research outputs","international cooperation","ethics/COI/data governance"]},
  "human_review": {"status":"PENDING","reviewer_authority_required":true,"reviewed_on":null,"review_notes":"First-pass Latin America anchor dossier; no final score or canonical inclusion decision.","correction_status":"NOT_OPEN"}
}
